{
  "id": "us-microsoft",
  "label": "United States — Microsoft",
  "note": "Microsoft’s observed US holidays.",
  "rules": [
    {
      "kind": "fixed",
      "month": 1,
      "day": 1,
      "name": "New Year's Day",
      "observance": "nearest-weekday"
    },
    {
      "kind": "nth-weekday",
      "month": 1,
      "weekday": 1,
      "nth": 3,
      "name": "Martin Luther King Jr. Day"
    },
    {
      "kind": "nth-weekday",
      "month": 2,
      "weekday": 1,
      "nth": 3,
      "name": "Presidents' Day"
    },
    {
      "kind": "last-weekday",
      "month": 5,
      "weekday": 1,
      "name": "Memorial Day"
    },
    {
      "kind": "fixed",
      "month": 7,
      "day": 4,
      "name": "Independence Day",
      "observance": "nearest-weekday"
    },
    {
      "kind": "nth-weekday",
      "month": 9,
      "weekday": 1,
      "nth": 1,
      "name": "Labor Day"
    },
    {
      "kind": "nth-weekday",
      "month": 11,
      "weekday": 4,
      "nth": 4,
      "name": "Thanksgiving Day"
    },
    {
      "kind": "relative",
      "to": "Thanksgiving Day",
      "offset": 1,
      "name": "Day after Thanksgiving"
    },
    {
      "kind": "fixed",
      "month": 12,
      "day": 25,
      "name": "Christmas Day",
      "observance": "nearest-weekday"
    },
    {
      "kind": "relative",
      "to": "Christmas Day",
      "offset": -1,
      "name": "Christmas Eve"
    }
  ]
}
